[
  {
    "country": "ZZB",
    "axis": "A",
    "year": 1960,
    "axis_score": 20,
    "coverage": 0.5385,
    "contributing_indicators": [
      "A1",
      "A4",
      "A5"
    ],
    "missing_indicators": [
      "A2",
      "A3",
      "A6"
    ],
    "below_coverage_threshold": false,
    "is_baseline_year": true
  },
  {
    "country": "ZZB",
    "axis": "B",
    "year": 1960,
    "axis_score": null,
    "coverage": 0,
    "contributing_indicators": [],
    "missing_indicators": [
      "B1",
      "B2",
      "B3",
      "B4",
      "B5"
    ],
    "below_coverage_threshold": true,
    "is_baseline_year": true
  },
  {
    "country": "ZZB",
    "axis": "A",
    "year": 1961,
    "axis_score": 20,
    "coverage": 0.5385,
    "contributing_indicators": [
      "A1",
      "A4",
      "A5"
    ],
    "missing_indicators": [
      "A2",
      "A3",
      "A6"
    ],
    "below_coverage_threshold": false,
    "is_baseline_year": false
  },
  {
    "country": "ZZB",
    "axis": "B",
    "year": 1961,
    "axis_score": null,
    "coverage": 0,
    "contributing_indicators": [],
    "missing_indicators": [
      "B1",
      "B2",
      "B3",
      "B4",
      "B5"
    ],
    "below_coverage_threshold": true,
    "is_baseline_year": false
  },
  {
    "country": "ZZB",
    "axis": "A",
    "year": 1962,
    "axis_score": 20,
    "coverage": 0.5385,
    "contributing_indicators": [
      "A1",
      "A4",
      "A5"
    ],
    "missing_indicators": [
      "A2",
      "A3",
      "A6"
    ],
    "below_coverage_threshold": false,
    "is_baseline_year": false
  },
  {
    "country": "ZZB",
    "axis": "B",
    "year": 1962,
    "axis_score": null,
    "coverage": 0,
    "contributing_indicators": [],
    "missing_indicators": [
      "B1",
      "B2",
      "B3",
      "B4",
      "B5"
    ],
    "below_coverage_threshold": true,
    "is_baseline_year": false
  },
  {
    "country": "ZZB",
    "axis": "A",
    "year": 1963,
    "axis_score": 20,
    "coverage": 0.5385,
    "contributing_indicators": [
      "A1",
      "A4",
      "A5"
    ],
    "missing_indicators": [
      "A2",
      "A3",
      "A6"
    ],
    "below_coverage_threshold": false,
    "is_baseline_year": false
  },
  {
    "country": "ZZB",
    "axis": "B",
    "year": 1963,
    "axis_score": null,
    "coverage": 0,
    "contributing_indicators": [],
    "missing_indicators": [
      "B1",
      "B2",
      "B3",
      "B4",
      "B5"
    ],
    "below_coverage_threshold": true,
    "is_baseline_year": false
  },
  {
    "country": "ZZB",
    "axis": "A",
    "year": 1964,
    "axis_score": 20,
    "coverage": 0.5385,
    "contributing_indicators": [
      "A1",
      "A4",
      "A5"
    ],
    "missing_indicators": [
      "A2",
      "A3",
      "A6"
    ],
    "below_coverage_threshold": false,
    "is_baseline_year": false
  },
  {
    "country": "ZZB",
    "axis": "B",
    "year": 1964,
    "axis_score": null,
    "coverage": 0,
    "contributing_indicators": [],
    "missing_indicators": [
      "B1",
      "B2",
      "B3",
      "B4",
      "B5"
    ],
    "below_coverage_threshold": true,
    "is_baseline_year": false
  },
  {
    "country": "ZZB",
    "axis": "A",
    "year": 1965,
    "axis_score": 20,
    "coverage": 0.5385,
    "contributing_indicators": [
      "A1",
      "A4",
      "A5"
    ],
    "missing_indicators": [
      "A2",
      "A3",
      "A6"
    ],
    "below_coverage_threshold": false,
    "is_baseline_year": false
  },
  {
    "country": "ZZB",
    "axis": "B",
    "year": 1965,
    "axis_score": null,
    "coverage": 0,
    "contributing_indicators": [],
    "missing_indicators": [
      "B1",
      "B2",
      "B3",
      "B4",
      "B5"
    ],
    "below_coverage_threshold": true,
    "is_baseline_year": false
  },
  {
    "country": "ZZB",
    "axis": "A",
    "year": 1966,
    "axis_score": 20,
    "coverage": 0.5385,
    "contributing_indicators": [
      "A1",
      "A4",
      "A5"
    ],
    "missing_indicators": [
      "A2",
      "A3",
      "A6"
    ],
    "below_coverage_threshold": false,
    "is_baseline_year": false
  },
  {
    "country": "ZZB",
    "axis": "B",
    "year": 1966,
    "axis_score": null,
    "coverage": 0,
    "contributing_indicators": [],
    "missing_indicators": [
      "B1",
      "B2",
      "B3",
      "B4",
      "B5"
    ],
    "below_coverage_threshold": true,
    "is_baseline_year": false
  },
  {
    "country": "ZZB",
    "axis": "A",
    "year": 1967,
    "axis_score": 20,
    "coverage": 0.5385,
    "contributing_indicators": [
      "A1",
      "A4",
      "A5"
    ],
    "missing_indicators": [
      "A2",
      "A3",
      "A6"
    ],
    "below_coverage_threshold": false,
    "is_baseline_year": false
  },
  {
    "country": "ZZB",
    "axis": "B",
    "year": 1967,
    "axis_score": null,
    "coverage": 0,
    "contributing_indicators": [],
    "missing_indicators": [
      "B1",
      "B2",
      "B3",
      "B4",
      "B5"
    ],
    "below_coverage_threshold": true,
    "is_baseline_year": false
  },
  {
    "country": "ZZB",
    "axis": "A",
    "year": 1968,
    "axis_score": 20,
    "coverage": 0.5385,
    "contributing_indicators": [
      "A1",
      "A4",
      "A5"
    ],
    "missing_indicators": [
      "A2",
      "A3",
      "A6"
    ],
    "below_coverage_threshold": false,
    "is_baseline_year": false
  },
  {
    "country": "ZZB",
    "axis": "B",
    "year": 1968,
    "axis_score": null,
    "coverage": 0,
    "contributing_indicators": [],
    "missing_indicators": [
      "B1",
      "B2",
      "B3",
      "B4",
      "B5"
    ],
    "below_coverage_threshold": true,
    "is_baseline_year": false
  },
  {
    "country": "ZZB",
    "axis": "A",
    "year": 1969,
    "axis_score": 20,
    "coverage": 0.5385,
    "contributing_indicators": [
      "A1",
      "A4",
      "A5"
    ],
    "missing_indicators": [
      "A2",
      "A3",
      "A6"
    ],
    "below_coverage_threshold": false,
    "is_baseline_year": false
  },
  {
    "country": "ZZB",
    "axis": "B",
    "year": 1969,
    "axis_score": null,
    "coverage": 0,
    "contributing_indicators": [],
    "missing_indicators": [
      "B1",
      "B2",
      "B3",
      "B4",
      "B5"
    ],
    "below_coverage_threshold": true,
    "is_baseline_year": false
  },
  {
    "country": "ZZB",
    "axis": "A",
    "year": 1970,
    "axis_score": 20,
    "coverage": 0.5385,
    "contributing_indicators": [
      "A1",
      "A4",
      "A5"
    ],
    "missing_indicators": [
      "A2",
      "A3",
      "A6"
    ],
    "below_coverage_threshold": false,
    "is_baseline_year": false
  },
  {
    "country": "ZZB",
    "axis": "B",
    "year": 1970,
    "axis_score": null,
    "coverage": 0,
    "contributing_indicators": [],
    "missing_indicators": [
      "B1",
      "B2",
      "B3",
      "B4",
      "B5"
    ],
    "below_coverage_threshold": true,
    "is_baseline_year": false
  },
  {
    "country": "ZZB",
    "axis": "A",
    "year": 1971,
    "axis_score": 20,
    "coverage": 0.5385,
    "contributing_indicators": [
      "A1",
      "A4",
      "A5"
    ],
    "missing_indicators": [
      "A2",
      "A3",
      "A6"
    ],
    "below_coverage_threshold": false,
    "is_baseline_year": false
  },
  {
    "country": "ZZB",
    "axis": "B",
    "year": 1971,
    "axis_score": null,
    "coverage": 0,
    "contributing_indicators": [],
    "missing_indicators": [
      "B1",
      "B2",
      "B3",
      "B4",
      "B5"
    ],
    "below_coverage_threshold": true,
    "is_baseline_year": false
  },
  {
    "country": "ZZB",
    "axis": "A",
    "year": 1972,
    "axis_score": 20,
    "coverage": 0.5385,
    "contributing_indicators": [
      "A1",
      "A4",
      "A5"
    ],
    "missing_indicators": [
      "A2",
      "A3",
      "A6"
    ],
    "below_coverage_threshold": false,
    "is_baseline_year": false
  },
  {
    "country": "ZZB",
    "axis": "B",
    "year": 1972,
    "axis_score": null,
    "coverage": 0,
    "contributing_indicators": [],
    "missing_indicators": [
      "B1",
      "B2",
      "B3",
      "B4",
      "B5"
    ],
    "below_coverage_threshold": true,
    "is_baseline_year": false
  },
  {
    "country": "ZZB",
    "axis": "A",
    "year": 1973,
    "axis_score": 20,
    "coverage": 0.5385,
    "contributing_indicators": [
      "A1",
      "A4",
      "A5"
    ],
    "missing_indicators": [
      "A2",
      "A3",
      "A6"
    ],
    "below_coverage_threshold": false,
    "is_baseline_year": false
  },
  {
    "country": "ZZB",
    "axis": "B",
    "year": 1973,
    "axis_score": null,
    "coverage": 0,
    "contributing_indicators": [],
    "missing_indicators": [
      "B1",
      "B2",
      "B3",
      "B4",
      "B5"
    ],
    "below_coverage_threshold": true,
    "is_baseline_year": false
  },
  {
    "country": "ZZB",
    "axis": "A",
    "year": 1974,
    "axis_score": 20,
    "coverage": 0.5385,
    "contributing_indicators": [
      "A1",
      "A4",
      "A5"
    ],
    "missing_indicators": [
      "A2",
      "A3",
      "A6"
    ],
    "below_coverage_threshold": false,
    "is_baseline_year": false
  },
  {
    "country": "ZZB",
    "axis": "B",
    "year": 1974,
    "axis_score": null,
    "coverage": 0,
    "contributing_indicators": [],
    "missing_indicators": [
      "B1",
      "B2",
      "B3",
      "B4",
      "B5"
    ],
    "below_coverage_threshold": true,
    "is_baseline_year": false
  },
  {
    "country": "ZZB",
    "axis": "A",
    "year": 1975,
    "axis_score": 20,
    "coverage": 0.5385,
    "contributing_indicators": [
      "A1",
      "A4",
      "A5"
    ],
    "missing_indicators": [
      "A2",
      "A3",
      "A6"
    ],
    "below_coverage_threshold": false,
    "is_baseline_year": false
  },
  {
    "country": "ZZB",
    "axis": "B",
    "year": 1975,
    "axis_score": null,
    "coverage": 0,
    "contributing_indicators": [],
    "missing_indicators": [
      "B1",
      "B2",